objectid,filename,youtubeid,title,creator,date,description,subject,location,latitude,longitude,source,identifier,type,format,language,rights,rightsstatement
coll001,testoralhistory.mp3,,Oral History Test Audio,Meredith Forrey,2020-11-09,This is an test audio recording for the Shoreline CC Pandemic Oral History Project,Pandemic; Oral History; Faculty,Kirkland,,,Form Submission,,Audio,audio/mp3,English,,https://creativecommons.org/licenses/by-nc-sa/4.0/
coll002,testoralhistory2.mp3,,2nd Oral History Test,Merida Forey,2020-11-08,A second audio test file.,Pandemic; Oral History; Student,Shoreline,,,Form Submission,,Audio,audio/mp3,English,,https://creativecommons.org/licenses/by-nc-sa/4.0/
coll003,pexels-jeffrey-czum-3330118.jpg,,House in the Middle of Crop Field,Jeffrey Czum,2019-11-06,A photo from the site Pexels to stand in for eventual other photos.,Photo,Kansas,,,Form Submission,,Photo,image/jpg,English,,https://www.pexels.com/license/
coll004,pexels-pixabay-533982.jpg,,Grass Field During Golden Hour,Pixabay,2011-07-20,A photo from the site Pexels to stand in for eventual other photos.,Photo,Colfax,,,Form Submission,,Photo,image/jpg,English,,https://www.pexels.com/license/
coll005,pexels-tetyana-kovyrina-1600139.jpg,,Close Up of Wheat,Tetyana Kovyrina,2018-11-15,A photo from the site Pexels to stand in for eventual other photos.,Photo,Washtucna,,,Form Submission,,Photo,image/jpg,English,,https://www.pexels.com/license/
